{
  "status": "REJECT",
  "checked_at": "2026-07-15T14:01:15+09:00",
  "html_path": "output/index.html",
  "reviewed_screenshots": [
    {
      "viewport": "desktop",
      "capture_label": "initial",
      "path": "iter_003/design_review/desktop.png",
      "absolute_path": "C:\\Users\\PC-220627-03\\Desktop\\project\\my\\architecture-thinking\\content-harness-pipeline\\runs\\2026-07-15_ch8a0715\\iter_003\\design_review\\desktop.png",
      "width": 1440,
      "height": 960
    },
    {
      "viewport": "desktop",
      "capture_label": "01_activity1_scene2_intro_problem",
      "path": "iter_003/design_review/desktop__01_activity1_scene2_intro_problem.png",
      "absolute_path": "C:\\Users\\PC-220627-03\\Desktop\\project\\my\\architecture-thinking\\content-harness-pipeline\\runs\\2026-07-15_ch8a0715\\iter_003\\design_review\\desktop__01_activity1_scene2_intro_problem.png",
      "width": 1440,
      "height": 960
    },
    {
      "viewport": "desktop",
      "capture_label": "02_activity1_scene3_tutorial",
      "path": "iter_003/design_review/desktop__02_activity1_scene3_tutorial.png",
      "absolute_path": "C:\\Users\\PC-220627-03\\Desktop\\project\\my\\architecture-thinking\\content-harness-pipeline\\runs\\2026-07-15_ch8a0715\\iter_003\\design_review\\desktop__02_activity1_scene3_tutorial.png",
      "width": 1440,
      "height": 960
    },
    {
      "viewport": "desktop",
      "capture_label": "03_activity1_scene4_success",
      "path": "iter_003/design_review/desktop__03_activity1_scene4_success.png",
      "absolute_path": "C:\\Users\\PC-220627-03\\Desktop\\project\\my\\architecture-thinking\\content-harness-pipeline\\runs\\2026-07-15_ch8a0715\\iter_003\\design_review\\desktop__03_activity1_scene4_success.png",
      "width": 1440,
      "height": 960
    },
    {
      "viewport": "desktop",
      "capture_label": "04_activity2_scene1_type_a",
      "path": "iter_003/design_review/desktop__04_activity2_scene1_type_a.webp",
      "absolute_path": "C:\\Users\\PC-220627-03\\Desktop\\project\\my\\architecture-thinking\\content-harness-pipeline\\runs\\2026-07-15_ch8a0715\\iter_003\\design_review\\desktop__04_activity2_scene1_type_a.png",
      "width": 1440,
      "height": 960
    },
    {
      "viewport": "desktop",
      "capture_label": "05_activity2_scene2_type_b",
      "path": "iter_003/design_review/desktop__05_activity2_scene2_type_b.webp",
      "absolute_path": "C:\\Users\\PC-220627-03\\Desktop\\project\\my\\architecture-thinking\\content-harness-pipeline\\runs\\2026-07-15_ch8a0715\\iter_003\\design_review\\desktop__05_activity2_scene2_type_b.png",
      "width": 1440,
      "height": 960
    },
    {
      "viewport": "desktop",
      "capture_label": "06_activity2_scene3_type_c",
      "path": "iter_003/design_review/desktop__06_activity2_scene3_type_c.webp",
      "absolute_path": "C:\\Users\\PC-220627-03\\Desktop\\project\\my\\architecture-thinking\\content-harness-pipeline\\runs\\2026-07-15_ch8a0715\\iter_003\\design_review\\desktop__06_activity2_scene3_type_c.png",
      "width": 1440,
      "height": 960
    },
    {
      "viewport": "desktop",
      "capture_label": "07_activity2_scene4_repair_complete",
      "path": "iter_003/design_review/desktop__07_activity2_scene4_repair_complete.png",
      "absolute_path": "C:\\Users\\PC-220627-03\\Desktop\\project\\my\\architecture-thinking\\content-harness-pipeline\\runs\\2026-07-15_ch8a0715\\iter_003\\design_review\\desktop__07_activity2_scene4_repair_complete.png",
      "width": 1440,
      "height": 960
    },
    {
      "viewport": "desktop",
      "capture_label": "08_activity3_scene1_real_life_history",
      "path": "iter_003/design_review/desktop__08_activity3_scene1_real_life_history.png",
      "absolute_path": "C:\\Users\\PC-220627-03\\Desktop\\project\\my\\architecture-thinking\\content-harness-pipeline\\runs\\2026-07-15_ch8a0715\\iter_003\\design_review\\desktop__08_activity3_scene1_real_life_history.png",
      "width": 1440,
      "height": 960
    },
    {
      "viewport": "desktop",
      "capture_label": "09_activity3_scene2_popup_quiz",
      "path": "iter_003/design_review/desktop__09_activity3_scene2_popup_quiz.png",
      "absolute_path": "C:\\Users\\PC-220627-03\\Desktop\\project\\my\\architecture-thinking\\content-harness-pipeline\\runs\\2026-07-15_ch8a0715\\iter_003\\design_review\\desktop__09_activity3_scene2_popup_quiz.png",
      "width": 1440,
      "height": 960
    },
    {
      "viewport": "desktop",
      "capture_label": "10_activity3_scene3_final_certificate",
      "path": "iter_003/design_review/desktop__10_activity3_scene3_final_certificate.png",
      "absolute_path": "C:\\Users\\PC-220627-03\\Desktop\\project\\my\\architecture-thinking\\content-harness-pipeline\\runs\\2026-07-15_ch8a0715\\iter_003\\design_review\\desktop__10_activity3_scene3_final_certificate.png",
      "width": 1440,
      "height": 960
    }
  ],
  "overall_assessment": "전체 asset의 래스터 화풍과 도서관 무대 연속성은 대체로 맞지만, 핵심 학습 UI가 여러 장면에서 asset surface 안에 정확히 통합되지 못했습니다. 특히 튜토리얼 작업대와 활동 2 콘솔의 텍스트·선택지·키패드가 작거나 슬롯 중심에서 어긋나 초등 2학년 대상의 게임형 수리 경험보다 웹 오버레이처럼 보이는 문제가 있어 REJECT입니다.",
  "scene_reviews": [
    {
      "scene_id": "initial",
      "capture_label": "initial",
      "screenshot_path": "iter_003/design_review/desktop.png",
      "scene_purpose": "콘텐츠 접속 직후 도서관 시계 수리 미션을 명확하게 제시하고 시작 행동을 유도한다.",
      "overall_assessment": "타이틀 배너와 티켓 버튼은 장면 속 물건처럼 보이고 첫 화면 완성도는 양호합니다. 다만 subtitle이 배너 하단 장식과 가까워 초등 저학년용 첫 미션 문장으로는 조금 빽빽합니다.",
      "creative_direction": {
        "recommendation_level": "light",
        "concept_name": "도서관 수리 의뢰서 접수대",
        "rationale": "현재 현수막과 티켓 asset이 이미 컨셉을 잘 전달하므로 큰 변경보다 제목 safe zone 정렬만 다듬는 편이 적절합니다.",
        "core_metaphor": "학습자가 도서관 수리 의뢰서를 받고 미션 티켓을 누른다.",
        "visual_language": "따뜻한 목재 현수막, 금색 수리 티켓, 흐릿한 로비 배경을 유지한다.",
        "layout_strategy": "배너 안쪽 중앙 80% safe zone에 제목과 부제를 더 수직 분리하고 시작 티켓은 바닥 중앙에 둔다.",
        "interaction_surfaces": [
          "asset_title_mission_banner central title paper",
          "asset_reusable_library_ticket_button start CTA"
        ],
        "implementation_notes": [
          ".main-title span의 line-height를 1.18 이상으로 두고 배너 하단 장식과 최소 24px 여백을 확보한다."
        ]
      },
      "text_review": {
        "hero_mission_text": [
          {
            "severity": "low",
            "target": "#scene-title .main-title span inside asset_title_mission_banner central safe zone",
            "issue": "부제 문장이 배너 하단 장식과 가까워 제목과 한 덩어리로 붙어 보입니다.",
            "evidence": "desktop initial screenshot에서 청록색 부제가 큰 제목 바로 아래에 길게 놓이며 현수막 하단 장식과 시각적으로 가까워 보입니다.",
            "suggested_fix": "#scene-title .main-title span에 margin-top을 0.28em으로 늘리고 max-width를 700px 정도로 줄여 두 줄 균형을 안정화합니다."
          }
        ],
        "asset_internal_text": [],
        "action_feedback_text": []
      },
      "checks": {
        "asset_quality": [],
        "background_stage": [],
        "asset_component_fit": [],
        "card_button_panel_style": []
      },
      "priority_findings": [],
      "refine_suggestions": [
        "#scene-title .main-title span의 폭과 상단 여백을 조정해 asset_title_mission_banner의 중앙 종이 safe zone 안에 더 여유 있게 배치합니다."
      ]
    },
    {
      "scene_id": "01_activity1_scene2_intro_problem",
      "capture_label": "01_activity1_scene2_intro_problem",
      "screenshot_path": "iter_003/design_review/desktop__01_activity1_scene2_intro_problem.png",
      "scene_purpose": "시계 고장으로 혼란에 빠진 도서관 상황을 보여주고 수리 필요성을 만든다.",
      "overall_assessment": "고장 난 로비와 큰 시계, 당황한 사서가 즉시 문제 상황을 전달합니다. 다만 말풍선이 너무 크게 떠서 캐릭터와 데스크를 덮고, 상단 scene chip과 에너지 게이지는 일반 웹 UI처럼 보입니다.",
      "creative_direction": {
        "recommendation_level": "light",
        "concept_name": "고장 신고 방송 데스크",
        "rationale": "큰 시계와 사서의 위기 장면은 충분히 읽히므로, 대사와 진행 UI를 도서관 방송 장치나 안내판 표면으로 흡수하는 정도가 적합합니다.",
        "core_metaphor": "고장 난 중앙 시계 앞에서 사서가 도서관 방송으로 구조 요청을 보낸다.",
        "visual_language": "말풍선은 유지하되 데스크 위 방송 안내판처럼 낮추고, 진행도는 벽면 수리 계량기로 통합한다.",
        "layout_strategy": "사서 얼굴과 손동작은 가리지 않고 대사 surface를 오른쪽 데스크 위로 낮춰 배치한다.",
        "interaction_surfaces": [
          "speech_bubble_blank over librarian desk area",
          "new reusable repair energy meter top-right"
        ],
        "implementation_notes": [
          "#scene-intro .speech.librarian-bubble의 width를 줄이고 right/bottom을 조정해 얼굴과 상체 표현을 보존합니다."
        ]
      },
      "text_review": {
        "hero_mission_text": [
          {
            "severity": "medium",
            "target": "#scene-intro .scene-title-chip",
            "issue": "장면 제목이 흰색 웹 칩으로 떠 있어 도서관 수리 모험의 물리 표면이 아닙니다.",
            "evidence": "screenshot 상단 중앙의 'Scene 2...' 라벨은 배경의 표지판이나 전광판이 아니라 둥근 흰 웹 배지로 보입니다.",
            "suggested_fix": "scene title을 작은 목재 책갈피/도서관 층 안내판 asset 표면 위 HTML 텍스트로 바꾸거나, 기존 chip을 벽면 상단 목재 프레임 안쪽에 붙은 라벨처럼 색과 그림자를 조정합니다."
          }
        ],
        "asset_internal_text": [],
        "action_feedback_text": [
          {
            "severity": "medium",
            "target": "#scene-intro .speech.librarian-bubble approx x=870..1295 y=360..585 in 1440x960 screenshot",
            "issue": "말풍선이 사서 캐릭터의 몸과 데스크를 크게 덮어 캐릭터 표정·동작과 무대 깊이를 약화합니다.",
            "evidence": "desktop screenshot에서 대사 bubble이 우측 캐릭터 위에 크게 올라와 앞치마와 손동작 일부를 가립니다.",
            "suggested_fix": "말풍선을 width 380~400px로 줄이고 bottom을 42vh 이하로 낮춰 사서 얼굴과 손이 온전히 보이게 하며, tail이 사서 입 쪽을 향하도록 배치합니다."
          }
        ]
      },
      "checks": {
        "asset_quality": [],
        "background_stage": [],
        "asset_component_fit": [
          {
            "severity": "medium",
            "target": "#topbar .energy-wrap",
            "issue": "수리 에너지 게이지가 일반 웹 progress bar처럼 보이며 도서관 장면 속 장치로 통합되지 않았습니다.",
            "evidence": "상단 우측 게이지는 회색 바와 흰 테두리로 떠 있고 배경의 벽면 장치나 수리 계량기와 연결되지 않습니다.",
            "suggested_fix": "상단 우측에 재사용 가능한 수리 에너지 미터 asset을 두고 .energy-fill만 그 안의 유리관/배터리 슬롯에 오버레이합니다."
          }
        ],
        "card_button_panel_style": [
          {